{
  "$schema": "https://json-schema.org/draft/2020-12/schema",
  "$id": "kalshi_paper_ledger_entry.schema.json",
  "title": "KalshiPaperLedgerEntry",
  "description": "Phase 4P — Paper ledger entry recording hypothetical economics for one contract unit from a Phase 4O signal evaluation summary. Non-actionable, offline-safe, unsettled fixture observation.",
  "type": "object",
  "required": [
    "kalshi_paper_ledger_entry_id",
    "schema_version",
    "generated_at",
    "ledger_mode",
    "source_phase",
    "signal_evaluation_summary_id",
    "signal_evaluation_summary_schema_version",
    "market_snapshot_id",
    "market_snapshot_schema_version",
    "input_artifact_refs",
    "paper_accounting_mode",
    "paper_entry_status",
    "paper_outcome_status",
    "market_ticker",
    "event_ticker",
    "condition_family",
    "paper_contract_side",
    "paper_units",
    "paper_entry_price_cents",
    "paper_mark_price_cents",
    "paper_unrealized_pnl_cents",
    "paper_realized_pnl_cents",
    "paper_fees_cents",
    "paper_net_pnl_cents",
    "paper_settlement_status",
    "research_notes",
    "paper_only",
    "live_execution_allowed",
    "order_placement_allowed",
    "credentials_used",
    "network_request_used",
    "emits_signal_events",
    "emits_recommendations",
    "emits_decisions",
    "emits_orders",
    "emits_live_positions",
    "emits_paper_ledger_entries",
    "reason_code",
    "reason"
  ],
  "additionalProperties": false,
  "properties": {
    "kalshi_paper_ledger_entry_id": {
      "type": "string",
      "pattern": "^kple_[a-f0-9]{32}$",
      "description": "Deterministic content-addressed ID: kple_ + first 32 hex chars of SHA-256."
    },
    "schema_version": {
      "const": "kalshi_paper_ledger_entry.v1"
    },
    "generated_at": {
      "type": "string",
      "format": "date-time"
    },
    "ledger_mode": {
      "const": "local_fixture_paper_only"
    },
    "source_phase": {
      "const": "Phase 4P"
    },
    "signal_evaluation_summary_id": {
      "type": "string",
      "pattern": "^kses_[a-f0-9]{32}$"
    },
    "signal_evaluation_summary_schema_version": {
      "const": "kalshi_signal_evaluation_summary.v1"
    },
    "market_snapshot_id": {
      "type": "string",
      "pattern": "^kms_[a-f0-9]{32}$"
    },
    "market_snapshot_schema_version": {
      "const": "kalshi_market_snapshot.v1"
    },
    "input_artifact_refs": {
      "type": "object",
      "required": ["signal_evaluation_summary", "market_snapshot"],
      "additionalProperties": false,
      "properties": {
        "signal_evaluation_summary": {
          "type": "object",
          "required": ["artifact_id", "schema_version"],
          "additionalProperties": false,
          "properties": {
            "artifact_id": {
              "type": "string",
              "pattern": "^kses_[a-f0-9]{32}$"
            },
            "schema_version": {
              "const": "kalshi_signal_evaluation_summary.v1"
            }
          }
        },
        "market_snapshot": {
          "type": "object",
          "required": ["artifact_id", "schema_version"],
          "additionalProperties": false,
          "properties": {
            "artifact_id": {
              "type": "string",
              "pattern": "^kms_[a-f0-9]{32}$"
            },
            "schema_version": {
              "const": "kalshi_market_snapshot.v1"
            }
          }
        }
      }
    },
    "paper_accounting_mode": {
      "const": "one_contract_unit_observation"
    },
    "paper_entry_status": {
      "const": "recorded_paper_observation"
    },
    "paper_outcome_status": {
      "const": "open_unsettled"
    },
    "market_ticker": {
      "type": "string",
      "minLength": 1
    },
    "event_ticker": {
      "type": "string",
      "minLength": 1
    },
    "condition_family": {
      "const": "descriptive_market_movement"
    },
    "paper_contract_side": {
      "enum": ["yes_contract"]
    },
    "paper_units": {
      "const": 1
    },
    "paper_entry_price_cents": {
      "type": "integer",
      "minimum": 0,
      "maximum": 99
    },
    "paper_mark_price_cents": {
      "type": "integer",
      "minimum": 0,
      "maximum": 99
    },
    "paper_unrealized_pnl_cents": {
      "type": "integer"
    },
    "paper_realized_pnl_cents": {
      "type": "null"
    },
    "paper_fees_cents": {
      "type": "integer"
    },
    "paper_net_pnl_cents": {
      "type": "integer"
    },
    "paper_settlement_status": {
      "const": "unsettled_fixture"
    },
    "research_notes": {
      "type": "object",
      "required": ["source_evaluation_status", "ledger_entry_scope", "runtime_reference"],
      "additionalProperties": false,
      "properties": {
        "source_evaluation_status": {
          "const": "evaluated_non_actionable"
        },
        "ledger_entry_scope": {
          "const": "paper_only_observation"
        },
        "runtime_reference": {
          "const": "none"
        }
      }
    },
    "paper_only": {
      "const": true
    },
    "live_execution_allowed": {
      "const": false
    },
    "order_placement_allowed": {
      "const": false
    },
    "credentials_used": {
      "const": false
    },
    "network_request_used": {
      "const": false
    },
    "emits_signal_events": {
      "const": false
    },
    "emits_recommendations": {
      "const": false
    },
    "emits_decisions": {
      "const": false
    },
    "emits_orders": {
      "const": false
    },
    "emits_live_positions": {
      "const": false
    },
    "emits_paper_ledger_entries": {
      "const": false
    },
    "reason_code": {
      "const": "PAPER_LEDGER_ENTRY_RECORDED"
    },
    "reason": {
      "type": "string",
      "minLength": 1
    }
  }
}
